<xs:schema attributeFormDefault="unqualified"
	elementFormDefault="qualified" xmlns:xs="http://www.w3.org/2001/XMLSchema">
	<xs:element name="Company">
		<xs:complexType>
			<xs:sequence>
				<xs:element name="Employee" maxOccurs="1" minOccurs="1">
					<xs:complexType>
						<xs:sequence>
							<xs:element type="xs:integer" name="Id" maxOccurs="1"
								minOccurs="1" />
							<xs:element type="xs:string" name="First_name"
								maxOccurs="1" minOccurs="1" />
							<xs:element type="xs:string" name="Last_name"
								maxOccurs="1" minOccurs="1" />
							<xs:element type="xs:string" name="Mobile" maxOccurs="1"
								minOccurs="1" />
						</xs:sequence>

						<xs:attribute name="emp_id" type="xs:string" use="required" />
					</xs:complexType>

				</xs:element>

				<xs:element name="Employee_parent" maxOccurs="1"
					minOccurs="1">
					<xs:complexType>
						<xs:sequence>
							<xs:element type="xs:string" name="Mother_name"
								maxOccurs="1" minOccurs="1" />
							<xs:element type="xs:string" name="Father_name"
								maxOccurs="1" minOccurs="1" />
						</xs:sequence>

						<xs:attribute name="emp_id" type="xs:string" use="required" />
					</xs:complexType>
				</xs:element>
			</xs:sequence>
		</xs:complexType>
	</xs:element>
</xs:schema>